{
  "$schema": "https://json-schema.org/draft/2020-12/schema",
  "$id": "https://ocentra.dev/schemas/ocentra-enforcer/enforcer-config.schema.json",
  "$comment": "generated by ocentra-enforcer schema exporter; source: schemas/effect/enforcer-schemas.mjs; schemaHash: sha256:a9e614b5d1ab83b5adb92801aa5034644a93ada9fa473ec5ca489507257c9e70",
  "title": "Ocentra Enforcer Config",
  "type": "object",
  "additionalProperties": true,
  "properties": {
    "schemaVersion": {
      "type": "number"
    },
    "profileName": {
      "type": "string"
    },
    "failOn": {
      "type": "array",
      "items": {
        "enum": [
          "error",
          "warning",
          "info"
        ]
      },
      "default": [
        "error"
      ]
    },
    "failFast": {
      "type": "boolean"
    },
    "enforceWorkspaceFiles": {
      "type": "boolean"
    },
    "requireCargoDeny": {
      "type": "boolean"
    },
    "requireCargoAudit": {
      "type": "boolean"
    },
    "runCargoDoc": {
      "type": "boolean"
    },
    "cargoOnFileScope": {
      "type": "boolean"
    },
    "cargoOnDiffScope": {
      "type": "boolean"
    },
    "cargoTestThreads": {
      "type": [
        "number",
        "null"
      ]
    },
    "allowUnsafeCode": {
      "type": "boolean"
    },
    "allowBuildRs": {
      "type": "boolean"
    },
    "allowedBuildRsPaths": {
      "type": "array",
      "items": {
        "type": "string"
      }
    },
    "allowGitDependencies": {
      "type": "boolean"
    },
    "allowPathDependencies": {
      "type": "boolean"
    },
    "publicReexportPolicy": {
      "enum": [
        "forbid",
        "facade-only",
        "allow"
      ]
    },
    "ignoreDirs": {
      "type": "array",
      "items": {
        "type": "string"
      }
    },
    "ignoreFileGlobs": {
      "type": "array",
      "items": {
        "type": "string"
      }
    },
    "rustRoots": {
      "type": "array",
      "items": {
        "type": "string"
      }
    },
    "crateRootGlobs": {
      "type": "array",
      "items": {
        "type": "string"
      }
    },
    "testFileGlobs": {
      "type": "array",
      "items": {
        "type": "string"
      }
    },
    "rawTypeBoundaryGlobs": {
      "type": "array",
      "items": {
        "type": "string"
      }
    },
    "boundaryOwnerNote": {
      "type": "string"
    },
    "facadeFileGlobs": {
      "type": "array",
      "items": {
        "type": "string"
      }
    },
    "rawStringOwnerGlobs": {
      "type": "array",
      "items": {
        "type": "string"
      }
    },
    "domainPrimitiveOwnerGlobs": {
      "type": "array",
      "items": {
        "type": "string"
      }
    },
    "enforceRuntimeStringLiterals": {
      "type": "boolean"
    },
    "runtimeStringOwnerGlobs": {
      "type": "array",
      "items": {
        "type": "string"
      }
    },
    "runtimeStringLineAllowPatterns": {
      "type": "array",
      "items": {
        "type": "string"
      }
    },
    "enforceSerializedPublicDomainPrimitives": {
      "type": "boolean"
    },
    "serializedDomainOwnerGlobs": {
      "type": "array",
      "items": {
        "type": "string"
      }
    },
    "blockedProtocolDependencies": {
      "type": "object",
      "additionalProperties": {
        "type": "array",
        "items": {
          "type": "string"
        }
      }
    },
    "runtimeCrates": {
      "type": "array",
      "items": {
        "type": "string"
      }
    },
    "testOnlyCrates": {
      "type": "array",
      "items": {
        "type": "string"
      }
    },
    "allowedGitDependencies": {
      "type": "array",
      "items": {
        "type": "string"
      }
    },
    "allowedExternalLicenses": {
      "type": "array",
      "items": {
        "type": "string"
      }
    },
    "sourceShapePolicies": {
      "type": "array",
      "items": {
        "$ref": "#/$defs/sourceShapePolicy"
      }
    },
    "sourceShapeOverrides": {
      "type": "array",
      "items": {
        "$ref": "#/$defs/sourceShapeOverride"
      }
    },
    "importBoundaryPolicies": {
      "type": "array",
      "items": {
        "$ref": "#/$defs/importBoundaryPolicy"
      }
    },
    "architecturePolicyChecks": {
      "type": "array",
      "items": {
        "enum": [
          "no-zod-source",
          "no-naked-domain-strings",
          "no-test-doubles",
          "weak-assertions",
          "skipped-focused-tests",
          "validation-bypass",
          "placeholder-implementation",
          "reexports",
          "cross-platform-script-commands",
          "generated-artifacts",
          "secrets",
          "rust-string-boundaries",
          "source-shape",
          "required-tests",
          "single-source-contracts",
          "dependency-policy",
          "sbom",
          "ai-rule-index",
          "import-boundaries"
        ]
      }
    },
    "singleSourceRequiredMirrorRoots": {
      "type": "array",
      "items": {
        "type": "string"
      }
    },
    "strictEmptyTestTrees": {
      "type": "boolean"
    },
    "generatedArtifactsMode": {
      "enum": [
        "scan",
        "tracked"
      ]
    },
    "generatedArtifactsTracked": {
      "type": "boolean"
    },
    "generatedArtifactsAllowlist": {
      "type": "array",
      "items": {
        "type": "string"
      }
    },
    "agentRuleMaxLines": {
      "type": "number"
    },
    "maxActiveWaivers": {
      "type": "number"
    },
    "maxWaiverDays": {
      "type": "number"
    },
    "configChangeRequiresSelfCheck": {
      "type": "boolean"
    },
    "policyIntegrityChecked": {
      "type": "boolean"
    },
    "languages": {
      "type": "array",
      "items": {
        "enum": [
          "rust",
          "typescript",
          "python",
          "common"
        ]
      }
    },
    "rules": {
      "type": "object",
      "additionalProperties": {
        "$ref": "#/$defs/policyOverride"
      }
    },
    "waivers": {
      "type": "array",
      "items": {
        "$ref": "#/$defs/waiver"
      }
    },
    "tools": {
      "type": "object",
      "additionalProperties": {
        "$ref": "#/$defs/policyOverride"
      }
    },
    "harness": {
      "type": "object",
      "additionalProperties": false,
      "properties": {
        "store": {
          "enum": [
            "ndjson-duckdb",
            "ndjson-only"
          ]
        },
        "storageDir": {
          "type": "string",
          "default": ".enforce"
        },
        "maxArtifactBytes": {
          "type": "number"
        },
        "maxRuns": {
          "type": [
            "number",
            "null"
          ]
        },
        "maxRunsPerTool": {
          "type": [
            "number",
            "null"
          ]
        },
        "maxFailedRuns": {
          "type": [
            "number",
            "null"
          ]
        },
        "pruneAfterDays": {
          "type": [
            "number",
            "null"
          ]
        }
      }
    }
  },
  "$defs": {
    "policyOverride": {
      "type": "object",
      "additionalProperties": false,
      "properties": {
        "enabled": {
          "type": "boolean"
        },
        "severity": {
          "enum": [
            "error",
            "warning",
            "info"
          ]
        },
        "note": {
          "type": "string"
        },
        "waiverId": {
          "type": "string"
        },
        "owner": {
          "type": "string"
        },
        "issue": {
          "type": "string"
        },
        "reason": {
          "type": "string"
        },
        "scope": {
          "type": "array",
          "items": {
            "type": "string"
          }
        },
        "expires": {
          "type": "string"
        },
        "remediation": {
          "type": "string"
        },
        "ciAllowed": {
          "type": "boolean"
        },
        "localAllowed": {
          "type": "boolean"
        },
        "visible": {
          "type": "boolean"
        }
      }
    },
    "waiver": {
      "type": "object",
      "additionalProperties": false,
      "required": [
        "ruleId",
        "waiverId",
        "owner",
        "issue",
        "reason",
        "scope",
        "expires",
        "remediation",
        "ciAllowed"
      ],
      "properties": {
        "ruleId": {
          "type": "string"
        },
        "waiverId": {
          "type": "string"
        },
        "owner": {
          "type": "string"
        },
        "issue": {
          "type": "string"
        },
        "reason": {
          "type": "string"
        },
        "scope": {
          "type": "array",
          "items": {
            "type": "string"
          },
          "minItems": 1
        },
        "expires": {
          "type": "string"
        },
        "remediation": {
          "type": "string"
        },
        "ciAllowed": {
          "type": "boolean"
        },
        "localAllowed": {
          "type": "boolean"
        },
        "visible": {
          "type": "boolean"
        }
      }
    },
    "sourceShapePolicy": {
      "type": "object",
      "additionalProperties": false,
      "properties": {
        "roots": {
          "type": "array",
          "items": {
            "type": "string"
          }
        },
        "extensions": {
          "type": "array",
          "items": {
            "type": "string"
          }
        },
        "kind": {
          "enum": [
            "typescript",
            "rust",
            "python"
          ]
        },
        "maxClasses": {
          "type": "number"
        },
        "maxExports": {
          "type": "number"
        },
        "maxFunctionLines": {
          "type": "number"
        },
        "maxFunctions": {
          "type": "number"
        },
        "maxLines": {
          "type": "number"
        },
        "maxNestingDepth": {
          "type": "number"
        },
        "maxBranches": {
          "type": "number"
        },
        "maxTypes": {
          "type": "number"
        }
      }
    },
    "sourceShapeOverride": {
      "type": "object",
      "additionalProperties": false,
      "properties": {
        "path": {
          "type": "string"
        },
        "paths": {
          "type": "array",
          "items": {
            "type": "string"
          }
        },
        "glob": {
          "type": "string"
        },
        "globs": {
          "type": "array",
          "items": {
            "type": "string"
          }
        },
        "note": {
          "type": "string"
        },
        "maxClasses": {
          "type": "number"
        },
        "maxExports": {
          "type": "number"
        },
        "maxFunctionLines": {
          "type": "number"
        },
        "maxFunctions": {
          "type": "number"
        },
        "maxLines": {
          "type": "number"
        },
        "maxNestingDepth": {
          "type": "number"
        },
        "maxBranches": {
          "type": "number"
        },
        "maxTypes": {
          "type": "number"
        }
      }
    },
    "importBoundaryPolicy": {
      "type": "object",
      "additionalProperties": false,
      "properties": {
        "roots": {
          "type": "array",
          "items": {
            "type": "string"
          }
        },
        "forbiddenImports": {
          "type": "array",
          "items": {
            "type": "string"
          }
        },
        "allowedImports": {
          "type": "array",
          "items": {
            "type": "string"
          }
        },
        "message": {
          "type": "string"
        }
      }
    }
  }
}
