{
  "schemaVersion": 2,
  "profileName": "strict",
  "failOn": ["error"],
  "failFast": false,
  "enforceWorkspaceFiles": true,
  "requireCargoDeny": true,
  "requireCargoAudit": false,
  "runCargoDoc": false,
  "cargoOnFileScope": false,
  "cargoOnDiffScope": false,
  "cargoTestThreads": null,
  "allowUnsafeCode": false,
  "allowBuildRs": false,
  "allowGitDependencies": false,
  "allowPathDependencies": false,
  "publicReexportPolicy": "forbid",
  "languages": ["rust"],
  "harness": {
    "store": "ndjson-duckdb",
    "storageDir": ".enforce",
    "maxArtifactBytes": 8000,
    "maxRuns": 50,
    "maxRunsPerTool": 20,
    "maxFailedRuns": 20,
    "pruneAfterDays": 14
  },
  "rules": {},
  "tools": {},
  "ignoreDirs": [".git", ".hub", ".turbo", "target", "node_modules", ".next", "dist", "build", "coverage", "output"],
  "ignoreFileGlobs": [],
  "rustRoots": ["src", "crates", "tools"],
  "crateRootGlobs": ["crates/*", "tools/*", "."],
  "testFileGlobs": [
    "**/tests/**",
    "**/*_test.rs",
    "**/*_tests.rs",
    "**/*_test_support.rs",
    "**/*_test_fixture.rs",
    "**/*_test_fixtures.rs"
  ],
  "rawTypeBoundaryGlobs": [
    "src/bin/**",
    "src/main.rs",
    "src/**/boundary/**",
    "src/**/boundaries/**",
    "src/**/adapter/**",
    "src/**/adapters/**",
    "src/**/ffi/**",
    "src/**/serde/**",
    "src/**/transport/**"
  ],
  "facadeFileGlobs": ["src/lib.rs", "src/api.rs", "src/prelude.rs", "src/**/api.rs", "src/**/prelude.rs"],
  "rawStringOwnerGlobs": [],
  "domainPrimitiveOwnerGlobs": [],
  "enforceRuntimeStringLiterals": false,
  "runtimeStringOwnerGlobs": [],
  "runtimeStringLineAllowPatterns": [
    "env!\\(",
    "#\\[tokio::main",
    "#\\[serde",
    "serde\\(",
    "cfg\\(",
    "#\\[path\\s*=",
    "panic!\\(",
    "format!\\(",
    "^\\s*(?:pub\\s+)?const\\s+[A-Z0-9_]+\\s*:\\s*&str\\s*=\\s*\""
  ],
  "enforceSerializedPublicDomainPrimitives": false,
  "serializedDomainOwnerGlobs": [],
  "blockedProtocolDependencies": {},
  "runtimeCrates": [],
  "testOnlyCrates": ["criterion", "mockall", "pretty_assertions", "proptest", "rstest", "wiremock"],
  "allowedGitDependencies": []
}
